{
  "schema_version": 2,
  "benefit_type": "sense",
  "scope": "catalog",
  "notes": "Schema fixture, not executable rules; homebrew IDs are illustrative.",
  "entries": [
    {
      "id": "demo:sense:1",
      "granted_by": {
        "kind": "homebrew",
        "namespace": "vtt_demo",
        "ref": {
          "category": "feat",
          "id": "demo:trait:sense"
        }
      },
      "benefit": {
        "type": "sense",
        "id": "demo:sense",
        "sense": {
          "type": "darkvision",
          "range_feet": 60
        }
      }
    }
  ]
}
