{
  "schema_version": 2,
  "benefit_type": "feature_grant",
  "scope": "catalog",
  "notes": "Schema fixture, not executable rules; homebrew IDs are illustrative.",
  "entries": [
    {
      "id": "demo:feature_grant:1",
      "granted_by": {
        "kind": "homebrew",
        "namespace": "vtt_demo",
        "ref": {
          "category": "feat",
          "id": "demo:trait:feature_grant"
        }
      },
      "benefit": {
        "type": "feature_grant",
        "id": "demo:feature_grant",
        "grants": [
          {
            "ref": {
              "name": "Defensive Field",
              "source": "TCE"
            }
          }
        ]
      }
    }
  ]
}
