{
  "schema_version": 2,
  "benefit_type": "roll_mode",
  "scope": "catalog",
  "notes": "Schema fixture, not executable rules; homebrew IDs are illustrative.",
  "entries": [
    {
      "id": "demo:roll_mode:1",
      "granted_by": {
        "kind": "homebrew",
        "namespace": "vtt_demo",
        "ref": {
          "category": "feat",
          "id": "demo:trait:roll_mode"
        }
      },
      "benefit": {
        "type": "roll_mode",
        "id": "demo:roll_mode",
        "roll_modes": [
          {
            "target": "saving_throw",
            "mode": "advantage",
            "context": "against_charm"
          }
        ]
      }
    }
  ]
}
