{
  "schema_version": 2,
  "benefit_type": "effect_extension",
  "scope": "catalog",
  "notes": "Schema fixture, not executable rules; homebrew IDs are illustrative.",
  "entries": [
    {
      "id": "demo:effect_extension:1",
      "granted_by": {
        "kind": "homebrew",
        "namespace": "vtt_demo",
        "ref": {
          "category": "feat",
          "id": "demo:trait:effect_extension"
        }
      },
      "benefit": {
        "type": "effect_extension",
        "id": "demo:effect_extension",
        "effects": [
          {
            "operation": "bonus_damage",
            "target_kind": "spell",
            "target_name": "Eldritch Blast",
            "value": "cha_mod",
            "trigger": "on_hit",
            "frequency": "each"
          }
        ]
      }
    }
  ]
}
