{
  "schema_version": 2,
  "benefit_type": "damage_modifier",
  "scope": "catalog",
  "notes": "Schema fixture, not executable rules; homebrew IDs are illustrative.",
  "entries": [
    {
      "id": "demo:damage_modifier:1",
      "granted_by": {
        "kind": "homebrew",
        "namespace": "vtt_demo",
        "ref": {
          "category": "feat",
          "id": "demo:trait:damage_modifier"
        }
      },
      "benefit": {
        "type": "damage_modifier",
        "id": "demo:damage_modifier",
        "effects": [
          {
            "operation": "reroll_damage_dice",
            "target": "damage_roll",
            "value": 2,
            "trigger": "on_damage"
          }
        ]
      }
    }
  ]
}
