{
  "schema_version": 2,
  "benefit_type": "companion_grant",
  "scope": "catalog",
  "notes": "Schema fixture, not executable rules; homebrew IDs are illustrative.",
  "entries": [
    {
      "id": "demo:companion_grant:1",
      "granted_by": {
        "kind": "homebrew",
        "namespace": "vtt_demo",
        "ref": {
          "category": "feat",
          "id": "demo:trait:companion_grant"
        }
      },
      "benefit": {
        "type": "companion_grant",
        "id": "demo:companion_grant",
        "grants": [
          {
            "id": "example:companion",
            "type": "monster",
            "quantity": 1
          }
        ]
      }
    }
  ]
}
