{
  "schema_version": 2,
  "benefit_type": "language",
  "scope": "catalog",
  "notes": "Schema fixture, not executable rules; homebrew IDs are illustrative.",
  "entries": [
    {
      "id": "demo:language:1",
      "granted_by": {
        "kind": "homebrew",
        "namespace": "vtt_demo",
        "ref": {
          "category": "feat",
          "id": "demo:trait:language"
        }
      },
      "benefit": {
        "type": "language",
        "id": "demo:language",
        "proficiencies": [
          {
            "kind": "language",
            "id": "elvish"
          }
        ]
      }
    }
  ]
}
