{
  "schema_version": 2,
  "benefit_type": "condition",
  "scope": "catalog",
  "notes": "Schema fixture, not executable rules; homebrew IDs are illustrative.",
  "entries": [
    {
      "id": "demo:condition:1",
      "granted_by": {
        "kind": "homebrew",
        "namespace": "vtt_demo",
        "ref": {
          "category": "feat",
          "id": "demo:trait:condition"
        }
      },
      "benefit": {
        "type": "condition",
        "id": "demo:condition",
        "condition": "poisoned",
        "effects": [
          {
            "operation": "condition",
            "condition": "poisoned",
            "trigger": "on_hit"
          }
        ]
      }
    }
  ]
}
