{
  "schema_version": 2,
  "benefit_type": "activation",
  "scope": "catalog",
  "notes": "Schema fixture, not executable rules; homebrew IDs are illustrative.",
  "entries": [
    {
      "id": "demo:activation:1",
      "granted_by": {
        "kind": "homebrew",
        "namespace": "vtt_demo",
        "ref": {
          "category": "feat",
          "id": "demo:trait:activation"
        }
      },
      "benefit": {
        "type": "activation",
        "id": "demo:activation",
        "activation": "reaction",
        "trigger": "on_hit"
      }
    }
  ]
}
