{
  "schema_version": 2,
  "benefit_type": "roll_bonus",
  "scope": "catalog",
  "entries": [
    {
      "id": "artificer:flash-of-genius:roll-bonus",
      "granted_by": {
        "kind": "5etools",
        "ref": {
          "category": "class_feature",
          "name": "Flash of Genius",
          "source": "TCE",
          "class_name": "Artificer",
          "class_source": "TCE"
        }
      },
      "benefit": {
        "type": "roll_bonus",
        "id": "flash_of_genius",
        "activation": "reaction",
        "resource": "Flash of Genius",
        "cost": 1,
        "bonus": {
          "targets": [
            "ability_check",
            "saving_throw"
          ],
          "ability_modifier": "int",
          "minimum": 1
        }
      }
    },
    {
      "id": "demo:roll_bonus:1",
      "granted_by": {
        "kind": "homebrew",
        "namespace": "vtt_demo",
        "ref": {
          "category": "feat",
          "id": "demo:trait:roll_bonus"
        }
      },
      "benefit": {
        "type": "roll_bonus",
        "id": "demo:roll_bonus",
        "bonus": {
          "targets": [
            "ability_check"
          ],
          "operation": "add",
          "amount": 2,
          "optional": false
        }
      }
    }
  ]
}
