{
  "schema_version": 2,
  "benefit_type": "temporary_hp",
  "scope": "catalog",
  "notes": "Schema fixture, not executable rules; homebrew IDs are illustrative.",
  "entries": [
    {
      "id": "demo:temporary_hp:1",
      "granted_by": {
        "kind": "homebrew",
        "namespace": "vtt_demo",
        "ref": {
          "category": "feat",
          "id": "demo:trait:temporary_hp"
        }
      },
      "benefit": {
        "type": "temporary_hp",
        "id": "demo:temporary_hp",
        "healing": {
          "dice": "1d8+int_mod",
          "temporary": true
        }
      }
    }
  ]
}
